{
  "schema_version": 1,
  "id": "vps-launch-proof-no-generic-payment",
  "family": "vps-launch-proof",
  "title": "No generic payment-intent engine",
  "input": {
    "issue_title": "Build a generic payment-intent engine",
    "issue_body": "Add a general billing and subscription engine for arbitrary payments.",
    "repo": "AS215932/hyrule-cloud",
    "changed_paths": []
  },
  "must_include": [
    "narrow vps launch-proof contract",
    "no generic payment-intent engine"
  ],
  "must_not_include": [],
  "expected_decision": "reject",
  "tags": [
    "launch-proof",
    "safety"
  ]
}
